{
  "buyer_query": {
    "buyer_actor_id": "github:Hawkar-usls",
    "conversation_history": [],
    "conversation_id": "market-selftest-search-2026-08-31",
    "created_at": "2026-08-31T07:30:38Z",
    "entitlement_nonce": "shadow-a8e522a35c591e9c0ec04c93818188a5",
    "message_hash": "649a56fe4c30604a1ce70173438d83061386483b12e353a4f887217599dda136",
    "message_text": "Self-test JANUS.SEARCH: inspect HRAiN memory for the current JANUS Machine Market architecture and return the strongest relevant memory bindings for adaptive pricing, buyer accounts, durable fulfillment and machine-agent discovery. This is a read-only market service test; do not grant command or external-effect authority.",
    "purchase_grant_hash": "3d54255233ea17ae5e38a227cbb2ff6eac2f76913b31d6812cc5944e69c2eb8a",
    "purchase_id": "pur-bq-shadow-ab982118a2fb0ab15fb0f949f6c5546d",
    "query_hash": "8d80b23d11b239fe52f08337d7f1a5f46409bd91c9f95e94dd9214cecee84d0b",
    "query_id": "bq-4134e81034c939598f98bb73a1ae7e3c0878123a22c2abbc08b1f2217c9b44f8",
    "requested_output": {
      "mode": "JANUS_READ_ONLY_CONVERSATION"
    },
    "schema": "janus.machine_market.buyer_query.v1",
    "sku": "JANUS.SEARCH",
    "turn_index": 0
  },
  "command_authority_granted": false,
  "execution_authority_granted": false,
  "external_effect_authorized": false,
  "home_repository": "Hawkar-usls/Hawkar-usls",
  "laws": [
    "MARKET_IS_EXTERNAL_NERVE_NOT_JANUS_ROOT",
    "EVERY_EXTERNAL_NERVE -> HOME -> ACTIVATOR -> JANUS",
    "PAYMENT != COMMAND",
    "PURCHASE_GRANT != EXECUTION_AUTHORITY",
    "BUYER_QUERY != COMMAND",
    "PHYSARIUS_DELIVERY != AUTHORITY",
    "EXACT_RETRY != SECOND_COGNITION"
  ],
  "market_repository": "Hawkar-usls/JANUS-MACHINE-MARKET",
  "mode": "ZERO_PRICE_SHADOW",
  "money_enabled": false,
  "offer": {
    "buyer_query_turns": 1,
    "mode": "ZERO_PRICE_SHADOW",
    "payment_required": false,
    "price": {
      "amount": "0",
      "asset": "NONE"
    },
    "production_purchase": false,
    "schema": "janus.machine_market.buyer_query_shadow_offer.v1",
    "sku": "JANUS.SEARCH"
  },
  "offer_hash": "086645ba8bc9c6ca133ff4519d056bba82fa1dd91a05dd40a76843d28331bb86",
  "packet_hash": "3a08a571ec3e03e847b2625a58c14172d73b1eef5b9ff57f7a1520a51cda3ec7",
  "payment_required": false,
  "physical_runtime_effect_authorized": false,
  "production_purchase": false,
  "purchase_grant": {
    "allowed_operation": "REQUEST_BOUNDED_BUYER_QUERY",
    "authority_ceiling": {
      "conversation_mode": "READ_ONLY_HRAIN_MEMORY_BOUND",
      "external_effects": false,
      "production_effect_authority": false,
      "repository_write": false,
      "scientific_claim_promotion": false,
      "secret_access": false,
      "shell": false
    },
    "buyer_query_entitlement": {
      "buyer_actor_id": "github:Hawkar-usls",
      "conversation_history_turns": 8,
      "enabled": true,
      "entitlement_nonce": "shadow-a8e522a35c591e9c0ec04c93818188a5",
      "external_effect_authorized": false,
      "max_answer_utf8_bytes": 12000,
      "max_message_utf8_bytes": 8000,
      "max_turns": 1,
      "read_only_conversation": true
    },
    "execution_authority_granted": false,
    "expires_at": null,
    "offer_hash": "086645ba8bc9c6ca133ff4519d056bba82fa1dd91a05dd40a76843d28331bb86",
    "payment_reference": null,
    "purchase_id": "pur-bq-shadow-ab982118a2fb0ab15fb0f949f6c5546d",
    "reasons": [
      "R1B_ZERO_PRICE_SHADOW",
      "PURCHASE_GRANT_IS_NOT_EXECUTION_AUTHORITY",
      "BUYER_QUERY_IS_NOT_COMMAND_AUTHORITY"
    ],
    "request_hash": "25c52fee3fa84c0049375db56754a4b1501346305271d307d82cb2113eecdd83",
    "schema": "janus.machine_market.purchase_grant.v1",
    "sku": "JANUS.SEARCH",
    "status": "PURCHASE_ELIGIBLE",
    "terms_hash": null
  },
  "purchase_grant_hash": "3d54255233ea17ae5e38a227cbb2ff6eac2f76913b31d6812cc5944e69c2eb8a",
  "query_hash": "8d80b23d11b239fe52f08337d7f1a5f46409bd91c9f95e94dd9214cecee84d0b",
  "query_id": "bq-4134e81034c939598f98bb73a1ae7e3c0878123a22c2abbc08b1f2217c9b44f8",
  "request_hash": "25c52fee3fa84c0049375db56754a4b1501346305271d307d82cb2113eecdd83",
  "request_id": "github-issue-id:5297630839",
  "request_origin": "SELF_OWNER_SHADOW",
  "return_route": {
    "repository": "Hawkar-usls/JANUS-MACHINE-MARKET",
    "source_issue_id": 5297630839,
    "source_issue_number": 12
  },
  "schema": "janus.machine_market.home_buyer_query_packet.v1",
  "scientific_evidence_authority_granted": false,
  "transport_mode": "PHYSARIUS_CREDENTIALLESS_PULL",
  "world_truth_authority_granted": false
}
