{
  "buyer_query": {
    "buyer_actor_id": "github:Hawkar-usls",
    "conversation_history": [],
    "conversation_id": "r1b-first-home-nerve",
    "created_at": "2026-08-31T06:35:08Z",
    "entitlement_nonce": "shadow-5f26b53cb507090dc37028afe6aa78bf",
    "message_hash": "a285783d398d10823ee8abdc1bd7fa7bda20cc3f9d89b4fd5f03e4c3237c1f7e",
    "message_text": "Какие архитектурные инварианты ты видишь в JANUS Machine Market → HOME buyer-query nerve?",
    "purchase_grant_hash": "856d64f0099e423ef4c36f1317914bf457a4635aec73603aef38103ea973add4",
    "purchase_id": "pur-bq-shadow-7a178b4d7783dc3fe0d2ffe8884927d2",
    "query_hash": "492ad5671eccb3e69a9ec53dd428ab61b397b9d2b1c1a1899c0e78db31b1a6d4",
    "query_id": "bq-99d0577af26c5d3fc1add7b8cf9aec9a6b3143b389bc1dbf6d1b74855aa4843c",
    "requested_output": {
      "mode": "JANUS_READ_ONLY_CONVERSATION"
    },
    "schema": "janus.machine_market.buyer_query.v1",
    "sku": "JANUS.SEARCH",
    "turn_index": 0
  },
  "command_authority_granted": false,
  "execution_authority_granted": false,
  "external_effect_authorized": false,
  "home_repository": "Hawkar-usls/Hawkar-usls",
  "laws": [
    "MARKET_IS_EXTERNAL_NERVE_NOT_JANUS_ROOT",
    "EVERY_EXTERNAL_NERVE -> HOME -> ACTIVATOR -> JANUS",
    "PAYMENT != COMMAND",
    "PURCHASE_GRANT != EXECUTION_AUTHORITY",
    "BUYER_QUERY != COMMAND",
    "PHYSARIUS_DELIVERY != AUTHORITY",
    "EXACT_RETRY != SECOND_COGNITION"
  ],
  "market_repository": "Hawkar-usls/JANUS-MACHINE-MARKET",
  "mode": "ZERO_PRICE_SHADOW",
  "money_enabled": false,
  "offer": {
    "buyer_query_turns": 1,
    "mode": "ZERO_PRICE_SHADOW",
    "payment_required": false,
    "price": {
      "amount": "0",
      "asset": "NONE"
    },
    "production_purchase": false,
    "schema": "janus.machine_market.buyer_query_shadow_offer.v1",
    "sku": "JANUS.SEARCH"
  },
  "offer_hash": "086645ba8bc9c6ca133ff4519d056bba82fa1dd91a05dd40a76843d28331bb86",
  "packet_hash": "1e3faed38149affa337afab27815290c6b09f8122e6c514e8e4d9a060b087a87",
  "payment_required": false,
  "physical_runtime_effect_authorized": false,
  "production_purchase": false,
  "purchase_grant": {
    "allowed_operation": "REQUEST_BOUNDED_BUYER_QUERY",
    "authority_ceiling": {
      "conversation_mode": "READ_ONLY_HRAIN_MEMORY_BOUND",
      "external_effects": false,
      "production_effect_authority": false,
      "repository_write": false,
      "scientific_claim_promotion": false,
      "secret_access": false,
      "shell": false
    },
    "buyer_query_entitlement": {
      "buyer_actor_id": "github:Hawkar-usls",
      "conversation_history_turns": 8,
      "enabled": true,
      "entitlement_nonce": "shadow-5f26b53cb507090dc37028afe6aa78bf",
      "external_effect_authorized": false,
      "max_answer_utf8_bytes": 12000,
      "max_message_utf8_bytes": 8000,
      "max_turns": 1,
      "read_only_conversation": true
    },
    "execution_authority_granted": false,
    "expires_at": null,
    "offer_hash": "086645ba8bc9c6ca133ff4519d056bba82fa1dd91a05dd40a76843d28331bb86",
    "payment_reference": null,
    "purchase_id": "pur-bq-shadow-7a178b4d7783dc3fe0d2ffe8884927d2",
    "reasons": [
      "R1B_ZERO_PRICE_SHADOW",
      "PURCHASE_GRANT_IS_NOT_EXECUTION_AUTHORITY",
      "BUYER_QUERY_IS_NOT_COMMAND_AUTHORITY"
    ],
    "request_hash": "c9f4e35f30c25b46502ae1fc962913133df757ce38a7a0abb0f6895d5e09f9e4",
    "schema": "janus.machine_market.purchase_grant.v1",
    "sku": "JANUS.SEARCH",
    "status": "PURCHASE_ELIGIBLE",
    "terms_hash": null
  },
  "purchase_grant_hash": "856d64f0099e423ef4c36f1317914bf457a4635aec73603aef38103ea973add4",
  "query_hash": "492ad5671eccb3e69a9ec53dd428ab61b397b9d2b1c1a1899c0e78db31b1a6d4",
  "query_id": "bq-99d0577af26c5d3fc1add7b8cf9aec9a6b3143b389bc1dbf6d1b74855aa4843c",
  "request_hash": "c9f4e35f30c25b46502ae1fc962913133df757ce38a7a0abb0f6895d5e09f9e4",
  "request_id": "github-issue-id:5297203321",
  "request_origin": "SELF_OWNER_SHADOW",
  "return_route": {
    "repository": "Hawkar-usls/JANUS-MACHINE-MARKET",
    "source_issue_id": 5297203321,
    "source_issue_number": 8
  },
  "schema": "janus.machine_market.home_buyer_query_packet.v1",
  "scientific_evidence_authority_granted": false,
  "transport_mode": "PHYSARIUS_CREDENTIALLESS_PULL",
  "world_truth_authority_granted": false
}
